{
  "firmName": "Studio Nusantara",
  "tagline": "Architecture rooted in place",
  "brandColor": "#1150AB",
  "email": "hello@studionusantara.id",
  "whatsapp": "+6281234567890",
  "instagram": "studionusantara",
  "phone": "+62 21 555 0123",
  "address": "Jakarta, Indonesia",
  "seoTitle": "Studio Nusantara — Architecture & Design",
  "seoDescription": "Architecture studio in Jakarta. Residential, commercial, and hospitality design rooted in Indonesian context."
}
